{
	"$schema": "https://json-schema.org/draft/2020-12/schema",
	"$id": "https://uwscope.org/schemas/clinical-history",
	"title": "IClinicalHistory",
	"description": "IClinicalHistory Type",
	"type": "object",
	"properties": {
		"_type": { "const": "clinicalHistory" },
		"_rev": { "type": "number" },
		"primaryCancerDiagnosis": {
			"type": "string"
		},
		"dateOfCancerDiagnosis": {
			"$ref": "/schemas/regexes#/properties/dateOfCancerDiagnosis"
		},
		"currentTreatmentRegimen": {
			"$ref": "/schemas/enums#/properties/cancerTreatmentRegimenFlags"
		},
		"currentTreatmentRegimenOther": {
			"type": "string"
		},
		"currentTreatmentRegimenNotes": {
			"type": "string"
		},
		"psychDiagnosis": {
			"type": "string"
		},
		"pastPsychHistory": {
			"type": "string"
		},
		"pastSubstanceUse": {
			"type": "string"
		},
		"psychSocialBackground": {
			"type": "string"
		}
	},
	"additionalProperties": false,
	"$comment": "None of the fields are required.",
	"required": ["_type"]
}
