{
	"_type": "clinicalHistory",
	"_rev": 1,
	"primaryCancerDiagnosis": "primaryCancerDiagnosis",
	"dateOfCancerDiagnosis": "2012-10-23",
	"currentTreatmentRegimen": {
		"Surgery": true,
		"Chemotherapy": true,
		"Radiation": true,
		"Stem Cell Transplant": true,
		"Immunotherapy": true,
		"CAR-T": true,
		"Endocrine": true,
		"Surveillance": true
	},
	"currentTreatmentRegimenOther": "currentTreatmentRegimenOther",
	"currentTreatmentRegimenNotes": "currentTreatmentRegimenNotes",
	"psychDiagnosis": "psychDiagnosis",
	"pastPsychHistory": "pastPsychHistory",
	"pastSubstanceUse": "pastSubstanceUse",
	"psychSocialBackground": "psychSocialBackground"
}
